{
  "workflow_key": "quality_compliance",
  "input_path": "../data/quality-compliance/input",
  "processing_path": "../data/quality-compliance/processing",
  "output_path": "../data/quality-compliance/output",
  "rejected_path": "../data/quality-compliance/rejected",
  "log_path": "../data/quality-compliance/logs",
  "barcode_types": ["code128", "auto"],
  "barcode_value_patterns": [],
  "scan_all_pages": true,
  "duplicate_handling": "reject",
  "file_stability_delay_ms": 2000,
  "max_pages_scan": 50,
  "poll_interval_ms": 500,
  "barcode_scan_dpi": 300,
  "barcode_upscale_factor": 1.0
}
