{
  "workflow_key": "default",
  "input_path": "./data/input",
  "processing_path": "./data/processing",
  "output_path": "./data/output",
  "rejected_path": "./data/rejected",
  "log_path": "./data/logs",
  "barcode_types": ["code128", "auto"],
  "barcode_value_patterns": [],
  "scan_all_pages": true,
  "duplicate_handling": "timestamp",
  "file_stability_delay_ms": 2000,
  "max_pages_scan": 50,
  "poll_interval_ms": 500,
  "barcode_scan_dpi": 300,
  "barcode_upscale_factor": 1.0,
  "server_host": "0.0.0.0",
  "server_port": 8080,
  "secret_key": "NXiu_BbSJNNu96tMCXt07E3q7OND_G7O1cy2lwf3UK9sG2XvSpJB-hD41z1Ki4Pi"
}
